,ad_id,ad_url,report_url,text,words,m_label
99,,,,why do members of the lqbtq community experience higher rates of mental illness watch the discussion about these challenges stigma and resources available in the community our regular facebook live events bring together experts from the mental health field and broader community to share information and about mental health topics and efforts to reduce stigma we held a panel discussion hosted by karl shallowhorn director of youth programs mental health advocates of wny speakers included ronald piaseczny jd lmhc president niagara pride inc susan frawley community and parent outreach services coordinator glys of wny inc matthew schwartz lcsw executive director the listening post of ny,health,health
100,,,,con edison is working to power our home with 100 clean energy transforming new york into an example of sustainability for the rest of the world from homes and apartments and everywhere in between renewables like solar are just the beginning of our renewable future,"renewables,renewable",environment
101,,,,our teachers are one of the primary reasons smithtown schools have such a excellent reputation we ll continue to support our hardworking staff and ensure that our district remains a desirable place to work our children s education and wellbeing depends on it teachersrock studentsuccess twomikesforsmithtown,"teachers,education",education
102,,,,great weekend of ossining events green ossining earthday festival always fun to hear the mike risko band and ossining fire department open house,no words,no topic
103,,,,what s happening with the back and forth on transport mask mandates and joe biden,no words,no topic
104,,,,green buildings are now the law in 9 major cities states cityzenith has the platform tech solution to help building owners meet regulations whilst saving a forecasted 280 billion for cities available already in new york city las vegas phoenix and los angeles cityzenith is on a mission to decarbonize america s 100 000 000 000 sq ft of commercial real estate join our 6 000 investment community today,green buildings,environment
105,,,,green buildings are now the law in 6 major cities in the us including new york boston and washington d c 50 000 buildings are set to be emission free in the big apple over the next few years alone pioneering digital twin tech company cityzenith helps building owners reduce energy costs and emissions by 50 100 while saving a forecasted 280 billion in efficiencies invest alongside 6 000 others in a better future for our cities and infrastructure,"energy costs,green buildings,emissions",environment
106,,,,please join us to hear from grace park bradbury who is the west coast general manager for blocpower there is no charge but you must register here blocpower is a climate technology company with the goal of making american cities smarter greener and healthier the company started in 2014 in brooklyn new york and has since retrofitted more than 1 000 buildings in disadvantaged communities in new york city with more projects occurring in several other us cities we will learn about the inspiring story behind donnel baird who is blocpower s ceo and founder why building electrification is essential to mitigating the climate crisis and the important role climate justice plays our speaker will also discuss blocpower s business model their role in the ithaca electrification effort and whether these approaches have been used or could be used in california there will be time for questions from the audience this presentation is being hosted by the north county climate change alliance and the san diego building electrification coalition,"climate,climate crisis,climate change,business model","economic,environment"
107,,,,here at nysut we like our coffee union brewed as starbucks workers in latham and albany are scheduled to vote on their union on may 17 we re encouraging members to show their support join the push for a stronger voice for starbucks workers across the state post photos of your coffee orders placed with the name union yes and make sure to tag sbworkersunited and use the hashtag unionyes,workers,economic
108,,,,we are live from the return of nysid s eighth annual create symposium where tomorrow s engineers make a difference today join us as we welcome remarks from state and local legislators student engineers and member agency representatives tune in later today for demonstrations of the assistive technology inventions created by student engineers to remove workplace barriers for people with disabilities within a nysid member agency you won t want to miss it the city college of new york manhattan college university at albany suny new york institute of technology suny polytechnic institute goodwill nynj the arc oneida lewis center for disability services constructive partnerships unlimited ahrc nassau,"disabilities,college,student","education,social and cultural"
109,,,,deeply researched and brilliantly told the right is a magisterial intellectual history of the last century of american conservatism,no words,no topic
110,,,,if you re looking for evidence that bail reform caused crime to rise you d be coming up blank right now in a new q a ames grawert of the brennan center for justice discusses findings from the center s new analysis of bailreform and crime rates in new york state critics misinformation campaigns and how providing more resources to social services can strengthen communities and steer people away from the criminal legal system full interview bit ly 3xryjtr,"bail,criminal",safety
111,,,,let s take care together happy earth day from the recycle right new york team knowbeforeyourthrow,no words,no topic
112,,,,we want to see you in new york it s been a while since we ve gathered to celebrate and the time has come join us on april 30th,no words,no topic
113,,,,we miss you we re gathering together on april 30th for the 2022 hrc new york dinner and it wouldn t be the same without you,no words,no topic
114,,,,neonic pesticides don t just hurt bees and other pollinators exposure to neonics is linked to serious birth defects of the heart and brain,no words,no topic
115,,,,no bees less food and if bees and other pollinators continue dying off food scarcity spiraling food costs and reduced access to healthy foods will worsen especially in low income communities and communities of color add your name to help protect bees and our food supply,no words,no topic
116,,,,your donations can help protect another american muslim from discrimination and injsutice support cair ny donate today,"muslim,cair,discrimination,donate","donation,social and cultural"
117,,,,health and environmental experts across the state of new york agree it s time to rein in toxic neonic pesticides,health,health
118,,,,dangerous neonic pesticides don t just kill bees birds and other pollinators they put the future of our food supply and our health at risk our food supply depends on bees and other pollinators,health,health
119,,,,executive order signed millions of new york residents now qualify for free health plans click learn more to qualify now health insurance dental vision hearing,"health,health insurance","health,social programs"
120,,,,political lines are always shifting in the middle east so it s best to stay up to date hear ambassador dennis ross appraisal of the current situation,no words,no topic
121,,,,mark your calendars join our team in lasalle for the niagara beautification commission annual city cleanup may 14th from 10am 12pm more details to come,no words,no topic
122,,,,alamo disrespecting george p bush may kill family s political dynasty please see the excellent article by isabel vincent that just came out in the new york post on march 4 describing the potential downfall of george p bush the piece goes into quite a bit of detail about the impact that all of us have had in the fight to save the alamo you can press this link to see the original we have also posted the full article below alamo disrespecting george p bush may kill family s political dynasty by isabel vincent march 4 2022 7 40am new york post at first glance george prescott bush seems the ideal political candidate in a state where his family has been a powerful dynasty for decades the telegenic texas lawyer is a grandson of 41st us president george h w bush and the nephew of george w bush the 43rd he is the eldest son of two term florida gov jeb bush and the great grandson of us sen prescott bush of connecticut the war veteran and father of two married to blond lawyer amanda williams bush is also mexican american on his mother s side and speaks fluent spanish but that might not be enough according to critics who accuse him of being the black sheep of the family and disrespecting the alamo texas most treasured symbol by bringing in modern minded out of staters for its restoration on tuesday bush 45 and incumbent ken paxton beat two other republican candidates vying to be the party s pick in the attorney general s race now a critical may runoff will determine whether the fourth generation scion will be able to shore up the family s political legacy in the lone star state analysts say but that s another problem the bush name is not popular in texas anymore luke twombly a dallas based political consultant and former communications director of the texas republican party told the post paxton the texas attorney general since 2015 has been indicted on securities fraud charges and accused of bribery and misuse of office in a civil whistleblower lawsuit but still has the support of the state s conservatives he also has the endorsement of former president donald trump a situation bush hopes to reverse by invoking trump in his campaign ads which don t mention the titans in his own family under the leadership of president trump our country was strong and vibrant again says bush in a campaign video at another point in the ad he notes like president trump i will not sit idly by while our freedoms are under attack because texas must lead the way in fighting this radical agenda if bush is trying to capitalize on his devotion to trump his opponents hope to end the bush family s political dominance in texas which began after george h w moved with his wife barbara from connecticut to the lone star state in 1948 to work in the oil business if conservatives unite we can end the bush dynasty paxton told a lubbock radio station wednesday the bushes have had their chances it s time for the dynasty to end bush commissioner of the general land office in texas has faced withering criticism from both democrats and fellow republicans for his work restoring the alamo historic site he s also been under scrutiny for his agency s administration of veterans homes where the covid fatality rate was 25 percent at seven out of nine facilities more than double the rate at the state s other nursing homes during the height of the pandemic in his eagerness to seek endorsements from trump bush has broken with members of his own family becoming the black sheep of a clan that has little patience for trump s hold on the republican party i can t imagine that george p is getting a lot of love from his family in pursuit of the trump endorsement said twombly although he likely needs trump s endorsement to win the race others say bush lacks the same leadership genes that propelled his relatives to political victory well maybe he s not exactly a black sheep but bush is not the guy jerry patterson bush s predecessor on the general land office told the post i knew 41 and 43 and bush is not a guy who is a leader he s a decent enough fellow but if you want someone to make hard decisions he s out of it he avoids controversy puts his head down as commissioner of the glo he has played fast and loose with the alamo the state s most sacred historic site he added patterson was so incensed with what he called bush s lack of transparency and bungling of the monument s restoration that he decided to run against him to get his old job back in 2018 when patterson lost to bush in the republican primary for the commissioner s job he decided to back bush s democratic opponent miguel suazo in the commissioner s race he wasn t the only one never in my memory have all primary opponents of a republican candidate either endorsed the primary winner s democratic opponent or stated publicly they wouldn t vote for the republican primary winner patterson said in addition to patterson losing republican primary opponents in the race rick range davey edward and david watts all refused to back bush there are things that are more important than your party said patterson who ran the glo between 2003 and 2015 the alamo is texas among the criticisms of bush s work on the restoration of the site which will include a new museum with a rooftop garden is a lack of transparency and the hiring of a philadelphia design firm that suggested incorporating modern glass walls calling in all these out of state so called experts who knew nothing about the alamo nothing about what it means to texas was bush s first mistake according to range a retired firefighter in an interview with the texas monthly he cannot be trusted with the future of the alamo range told the magazine he s flip flopped more times than a catfish stranded on the bank of a river despite the criticisms bush prominently features images of the alamo in his campaign ads which also include several references to trump s domestic policy greatest hits in his latest ad bush reminds viewers that he is a former navy officer deployed to afghanistan and promises to finish trump s wall he is filmed in dark glasses riding an all terrain vehicle in the shadow of the wall that marks the southern border with mexico it s such bulls t said patterson every damned politician talks about the wall but the attorney general has no impact on shutting down the border it s all bulls t it s almost what you have to do if you are a republican in texas still patterson like others is hesitant to write off bush just yet do i think he has a chance he said i think he has a chance bush s campaign and spokesman did not return the post s calls and emails thursday,"covid,border,pandemic,black","covid,immigration,social and cultural"
123,,,,westchester county news westchester county exec latimer caps gas tax orders free bus service this summer install news app trusted by millions to stay informed of latest westchester county local news,tax,economic
124,,,,via the cook political report ny04 is not just in play it will be one of the seats that flips congress from blue to red and takes the gavel away from nancy pelosi join the despositoforcongress team and donate now,donate,donation
125,,,,i received this from a resident in troy who went to samaritan hospital due to a lingering cough they gave her a basic examination and i am happy to report it was nothing serious however the bill she received weeks later was her insurance company did not cover the complete cost of the visit leaving her a balance there is absolutely no reason anybody should go into medical debt in the richest country in the world when i am elected i will fight for every new yorker to be covered by pushing the new york health act bill to the floor for a vote,"health,insurance company","health,social programs"
126,,,,breaking news new york residents may qualify for 20k 50k 100k loan assistance which will be deposited into your account the next day thanks to this emergency cash program,no words,no topic
127,,,,such an awesome night spent at the lebanon valley speedway as someone who used to compete in car shows myself i thought i d seen a lot but i ve never seen an event like this over 4 000 people turned out for opening night and the energy was amazing big thanks to all the organizers for such a warm welcome,lebanon,foreign policy
128,,,,à¦¦ à¦¶à¦¬ à¦£ à¦à¦ª à¦° à¦² à§¨à§¦à§¨à§¨,no words,no topic
129,,,,a gay couple is suing their former landlord in manhattan after they said they were banned from passing out candy on halloween in 2018 faced ongoing anti lgbtq harassment including when building management allegedly removed the couple s rainbow flag from their apartment anthony dolci his husband ming infante who previously lived at dorchester towers at 155 west 68th street in manhattan claim in their suit that they faced a barrage of adversity from the building during their time living there the 2 5 million lawsuit filed in new york s supreme court on august 20 accuses the building s former property manager mrs kelly ann whipple desrosier and vice president of ogden cap properties john mcdermott of defamation malicious prosecution discrimination and filing false police reports dolci a latinx man and his husband infante an asian man believe they were targeted because of their race and sexual orientation now they are calling for the building to be held accountable for the alleged actions halloween night is just a very small glimpse of the injustices that this building did to my family dolci said they allowed dorchester towers employees to call the police with impunity over and over simply because they didn t like us and they wanted us out of the building dorchester towers allegedly hired off duty nypd officers as security guards to stand in the lobby of the building due to accusations that the couple made tenants feel unsafe the complaint states on halloween night the security officers went even further and barred the couple from participating in trick or treating activities in the building in protest of the guard s orders dolci who was wearing a witch s hat no t shirt and a yellow cape headed outside with a bag of treats according to footage reviewed by gay city news dolci was holding a glow in the dark halloween globe and pleaded for help while the guards attempted to snatch his bag of candy from off of the street in the video the guards allegedly confirmed that they were calling the cops on dolci because he cannot block the pedestrians for what for standing on a public street infante chimed in from their bedroom window for standing on a public street the 22 page complaint claims the police were called at least 25 times on the couple with at least half of those times resulting in dolci being arrested or taken to local hospitals for psychiatric evaluations he added they were weaponizing the 911 call center against us dolci said the following year whipple allegedly told the couple they did not fit in with the building and did not dress appropriately for the building dolci claims the couple was repeatedly reprimanded for trivial reasons such as when whipple allegedly criticized the couple for listening to lgbtq singer boy george and madonna because it was not appropriate for the building i felt she s talking about my sexuality i wear nail polish i am flamboyant dolci said i think i didn t fit her idea of what a gay person should be for this building he added i m not gonna tiptoe around anyone with my sexuality and i think that when i stood up to her about that she retaliated the couple is also accusing the staff of removing the rainbow flag that was placed on their door general counsel for ogden cap properties stephen nahley denied the allegations the accusations contained in the lawsuit concerning dorchester towers ms whipple and our other employees are baseless totally without merit we will defend them vigorously and are confident that we will prevail nahley said in a written statement to gay city news whipple and mcdermott did not immediately reply to gay city news request for comment in march of 2019 the couple moved out of the apartment and soon after dolci began standing outside the high end condos in protest during a couple of dolci s one person rallies the building s staff allegedly began spraying and assaulting him with water hoses and damaging his signs dolci said he submitted this footage along with a complaint to the new york city human rights commission in a statement the commission said they cannot comment on the status of open investigations but once the matter is closed it is then publicly available information in april out gay ny state senator brad hoylman spoke out in support of the couple at the stop false police reporting rally at one police plaza in a statement to gay city news hoylman called the allegations of false police reports troubling and said he hopes we can get to the bottom of it last year as an outgrowth of the alleged harassment dolci started gays against dorchester towers a facebook page chronicling the couple s movement to hold the building responsible for their alleged actions we could have been the worst tenants in the building which we weren t dolci said but that doesn t justify breaking the law and abusing people and abusing their position of power and using the police as a weapon story and interview by tat bellamy walker,"discrimination,cops,gays,gay couple,officers,gay,supreme court,police,sexual orientation","governance,safety,social and cultural"
130,,,,gay couple sues dorchester towers for 2 5 million dollars my husband and i are suing dorchester towers ogden cap properties property manager kelly ann whipple and vice president john mcdermott for the following 1 filing false police reports 2 wrongful arrest 3 malicious prosecution 4 harassment 5 defamation of character in total dorchester towers filed 31 police reports against us and had me placed in handcuffs 10 times due to their false police reporting ny state senator brad hoylman deputy leader of the new york city council jimmy van bramer have written letters on our behalf requesting manhattan district attorney cy vance investigate our allegations against dorchester tower nyc commission on human rights is also taking legal action against dorchester towers for its staff s retaliating against me while i was peaceful protesting dorchester tower s unlawful actions on the public street the district attorney s office decided to drop all criminal charges after dorchester tower s current property manager kelly ann whipple failed to provide evidence to support her false allegations that i threatened to kill her completely untrue we encourage you to please share this link on your facebook page or visit stop false police reporting facebook stop false police reporting change org we thank you in advance for your feedback and support sincerely anthony dolci ming infante stopfalsepolicereporting gaysagainstdorchestertower kellyannwhipple dorchestertowercondo ogdencapproperties,"criminal,police,gay,gay couple","safety,social and cultural"
131,,,,honored to have the endorsement of schenectady city councilwoman and longtime family friend doreen ditoro like me she knows the challenges of owning a small business and never stops advocating our community i cannot wait to start working with her more closely as our next state senator senateready,small business,economic
132,,,,new york power authority s chairman john koelmel is tired of empire state development s slow pace of progress in redeveloping the cataract city where nypa generates the vast share of its lucrative hydroelectric power at governor kathy hochul s behest koelmel is stepping up to fill the city s devastating leadership void,"hydroelectric power,hydroelectric",environment
133,,,,nurses learn about the new staffing committees law taking effect this july at our free webinar,no words,no topic
134,,,,mo nehad of the texas backyard has a conversation on faith and peaceful coexistence with david hamilton david is a candidate for fort bend isd board,no words,no topic
135,,,,hello central new york i m sarah klee hood and i m running for congress in your district ny 22 to understand the challenges we face as a district and community we need somebody with tested leadership experience i m a former u s air force officer and i m currently an elected town councilor here in this district i have the experience i know the problems and i m ready to fight for all of us i m here to fight for our communities for our children and for our future learn more about why i m running and the issues i care about at sarahkleehoodny com follow me on twitter or instagram sarahkleehoodny for my daily thoughts on how we can make central new york a better place for all,no words,no topic
136,,,,historic border disaster in the making e3 66 a historic border disaster is just weeks away and an elected official predicts that by the end of biden s presidency an estimated 20 of the u s population will be in the country illegally trish looks at the economic complications plus wholesale prices now the highest in history proving inflation is not going away today s links there has never been a better time to invest in gold go to legacypminvestments com for more,"border,inflation,country illegally,economic","economic,immigration"
137,,,,june 19 celebrate juneteenth at ethical with a special performance by sweet honey in the rock hosted by tituss burgess all proceeds benefit harlem mothers save stop another violent end and their fight to end gun violence pre show meet and greet and post show cocktail hour tickets available more info and tickets,"gun violence,gun,mothers","safety,social and cultural"
138,,,,the wildly popular twitter account known as libs of tiktok simply holds a mirror up to the radical left and apparently that s just too embarrassing for one media figure who doxxed the woman behind it shapiro weighs in,no words,no topic
139,,,,newburgh news newburgh wants to implement city hotel room tax install news app trusted by millions to stay informed of latest newburgh local news,tax,economic
