,ad_id,ad_url,report_url,text,words,m_label
140,,,,new york we ve missed you calling future and current candidates and for the first time campaign managers and staff with a rich and empowering agenda this training will meet you where you are at join us at our first in person run 51 all in training on may 13 in binghamton we re ready to transform the state legislature and we need you register now we re all in for health and safety so covid protocols will be in place stay tuned for details,"health,covid","covid,health"
141,,,,the best and most enduring book written from inside the nixon white house a classic of lost illusions sidney blumenthal new york times bestselling author of the clinton wars,no words,no topic
142,,,,before you know it you are turning the pages of mr dean s book as if you are reading about watergate for the first time nyt,no words,no topic
143,,,,take our survey to let us know what issues you d like to be our focus take back our republic action fund cited examples from wisconsin to new york of how concerned citizens can make sure election officials are following election laws wisconsin clerks have until may 5 to send letters to tens of thousands of voters on the old indefinitely confined list and remove those who do not reply and could otherwise use the law to avoid popular voter id laws thank you to one of the largest media outlets in the county newsmax for running our piece,no words,no topic
144,,,,on this week s edition of new york now what to watch as session winds down and the primary approaches michael gormley from newsday and marina villenueve from the associated press join us on that and more new york working families party s sochie nnaemeka on 2022 strategy larry sharpe on his run for governor watch on air and online,no words,no topic
145,,,,the new york working families party one of the state s minor parties holds a lot of power among progressives in new york for more on the working families party candidates in this year s elections we spoke with wfp state director sochie nnaemeka new york now is on air and online,no words,no topic
146,,,,what the jpc drive thru free food giveaway when monday april 25 2022 from 2 pm to 6 30 pm rain snow or shine what the jpc walkers free food giveaway when tuesday april 26 2022 from 3 pm to 6 pm rain snow or shine where johnson park center jpc food pantry 1400 west street block utica ny 13501 contact jpc office from 1 pm to 5 pm 315 734 9608 email at revmeier johnsonparkcenter org utica ny recent increases in child poverty and the rising cost of food and fuel have resulted in continued very high demand for emergency food at the same time these increasing food and fuel costs have made it more challenging for food banks to distribute food to communities in need there are nearly 3 million new yorkers facing food insecurity every day food banks food pantries and emergency food providers process store and distribute food to hungry families and single individuals while economic uncertainty remains for working families and singles in our state this investment will help emergency food providers fight hunger by delivering more food to more people according to feeding new york statement on state budget we are thankful for the many in our community working together with jpc to fight hunger and food insecurity we thank our ongoing funders and donors for the financial gifts to purchase food for needy persons with the support from the food bank of central new york fbcny generous food donations from the compassion coalition various financial donors government private organizations and individuals our fantastic volunteers staff and board we will have the jpc food pantry drive thru cars vehicles only free food giveaway for disadvantaged families seniors and single individuals around jpc sites in the1400 block of west street utica new york 13501 rain snow or shine on monday april 25 2022 from 2 pm to 6 30 pm starting on the corner of arthur and west streets cars vehicles will line up at the registration station the registration personnel wearing facemasks will check all participants jpc food pantry card jpcfpc if you do not have a jpcfpc the registration personnel will ask you to print your name and check the processed cards if they find your card they will give it to you if the registration personnel does not see your card they will direct you to the intake station the intake personnel will check for the status concerning your jpcfpc if needed they will assist you in completing the required documents on site to receive a jpcfpc the registration or intake personnel will place the number of households represented on each car windshield then you will drive up to each food station where volunteers will put the food in your car vehicle if you do not have a car vehicle please come to the jpc food pantry walkers free food giveaway on tuesday april 26 2022 between 3 pm to 6 pm in the 1400 block of west street utica new york13501 rain snow or shine a tractor trailer full of food will be available to give to the community food items may include pollock fish canned chicken pepperoni pizza cheddar cheese macaroni cheese pasta sauce potatoes onions corn cabbage fresh produce fresh fruit almonds yogurt sliced bread etc during these challenging times of the coronavirus pandemic by fighting hunger and food insecurity the jpc free food giveaway helps families seniors and singles to have food on their tables be food secured and be a stepping stone to self sufficiency please join us as we need additional sponsors donors volunteers and media to make long term commitments to fight hunger and food insecurity you are unique to all currently making investments and partnering with jpc we are so grateful and appreciative of your dedication to serving families children and single individuals in need thank you food bank of central new york fbcny the compassion coalition the emergency food and shelter program efsp casa imports candella s farm greenhouses and the mohawk street hannaford stb enterprises inc apex document solutions jetnet llc excellus health plan inc the benevity community impact fund prestwick glen residents association the bank of utica first source federal credit union the community foundation of herkimer oneida counties the united way of the mohawk valley utica national foundation group capraro technologies inc cti the friends of johnson park center education fund m t bank partners charitable fund mele family fund all are donor advised funds at the community foundation of herkimer oneida counties the key bank stericycle inc hospice palliative care mvp health the oneida county youth bureau first baptist church jctod church seed of hope we received monetary and food donations from various donors businesses organizations and individual supporters the oneida county youth employment program our fantastic volunteers jpc jpa staff shelter program participants jpc facebook encouragers and supporters and media coverage from wktv wutr spectrum news the utica phoenix the observer dispatch rome sentinel 96 1 the eagle bug country 99 7 101 1 talk of the town 100 7 and american town utica thank you so much for your continued support join positive change at johnson park center jpc rev dr maria a scates d d jpc ceo founder,"banks,coronavirus,health,coronavirus pandemic,economic,fuel,monetary,pandemic,education","covid,economic,education,environment,health"
147,,,,our police officers are under attack across our state and country our amazing officers risk their lives to uphold the law day in and day out which is why as governor albany will start back the blue again join me by signing your name,"officers,police,police officers",safety
148,,,,the white house chief usher for nearly three decades offers a behind the scenes look at america s first families,no words,no topic
149,,,,olga will share what it was like to grow up under the ussr in ukraine while providing perspective of current living conditions of family and friends in current war torn ukraine dr alison thompson provides medical care to the injured and while evacuating children and injured women from ukraine how to provide assistance to the growing humanitarian crisis caused by the war in ukraine miami ukraine thatscommunity florida usa to find out what s going on in your community go to www communitynewspapers com,living conditions,social programs
150,,,,union carpenters and contractors build up our communities by lending their time and skills to those in need,no words,no topic
151,,,,conversations with distinguished professors and critically acclaimed authors about the history behind our news click for this episode visit our website for more episodes and podcast series french postcards were as close as one could get to playboy in the 19th century and apparently they were ubiquitous in america particularly during the civil war and according to our guest professor brett gary that s a good starting point to talk about the history of censorship in america anthony comstock served in the civil war and was appalled by the volume of pornography enjoyed by union soldiers after the war he manifested his dedication to upholding christian morality by becoming an anti vice activist to root out obscene literature to be sure many were committed to this cause but it was comstock who had the power to impose his righteousness on others because of his positions as the u s postal inspector and secretary of the new york society for the suppression of vice later the federal and many states mini comstock laws were named after him with these laws the vice squad raided bookstores threatened publishers and removed books from libraries and surprisingly these laws are still on the books even if they are rarely enforced but as time wore on the u s supreme court particularly during the warren court restricted the scope of the comstock laws so in our time while there is no censorship of adult literature school literature continues to be subject to local scrutiny and banning the latest high profile such censorship was in tennessee where maus a pulitzer prize winning book about the holocaust was banned professor gary takes us through the history of censorship including the pre civil war fear of race suicide all the way to the story of maus he teaches at nyu s dept of media culture and communication and his recent book is titled dirty works obscenity on trial in america s first sexual revolution,"soldiers,school,suicide,supreme court","education,governance,health,military,safety"
152,,,,as community board 8 chair and democratic leader on the east side russell squire is the only candidate running for our assembly seat who has the firsthand experience knowledge and vision to improve the east side clean up the east side keep east siders safe support east side children and families let s stand with russell in the democratic primary on june 28th join us www squireforny com,no words,no topic
153,,,,democrat russell squire is running for the state assembly to deliver the experience commitment and leadership we need in albany an attorney who has practiced complex cases and devoted himself to pro bono work russell is chair of community board 8 where he has dedicated himself to improving the east side and our quality of life the democratic primary is on june 28th join us www squireforny com,no words,no topic
154,,,,our leaders have been failing us when it comes to keeping our families safe we must do more to reduce crime and improve public safety democrat russell squire s priority is protecting new yorkers he s the only candidate who has been clear that dangerous repeat offenders must be kept off our streets vote to protect new yorkers on june 28th join us at www squireforny com,public safety,safety
155,,,,democrat russell squire and congresswoman carolyn maloney have been working hand in hand to deliver results for the east side from fighting for more efficient mass transit to funding our local parks playgrounds and senior centers they ve been protecting our democratic values and getting the results we deserve let s stand with russell and carolyn on june 28th join us at www squireforny com,no words,no topic
156,,,,keeping the east side affordable is a top priority for democrat russell squire the middle class should always be able to call our community home and new yorkers should never have to choose between paying the rent or mortgage and or paying for life saving medication in albany russell will fight to lower prescription drug prices and maintain middle class housing options the democratic primary is on june 28th join us at www squireforny com,"drug prices,prescription,prescription drug,middle class","economic,health"
157,,,,democrat russell squire s top priority is protecting our safety this means stricter gun laws taking repeat offenders off our streets and funding mental health services vote to protect new yorkers on june 28th join us at www squireforny com,"stricter gun,health,gun","health,safety"
158,,,,ibm s personal pension plan may pay pension benefits at levels below what the law requires find out if you re impacted,no words,no topic
159,,,,ahorra dinero en los altos precios de gasolina con estas opciones,no words,no topic
160,,,,vaccination is the best way to protect children from covid 19 learn how mrna vaccines work like invisible coaches to teach children s immune systems to recognize the virus,"covid,vaccines,virus,protect children,covid 19","covid,social and cultural,social programs"
161,,,,what can black dolls tell us about u s history find out in our special exhibition,black,social and cultural
162,,,,join us on our facebook page for an important maternaljustice conversation 4 26 at 4 30pm et and learn more about the birth equity act you will hear how parents and caregivers building movement on birth maternal reproductive health equity in nyc,"health,reproductive health","health,social and cultural"
163,,,,on april 30 mount sinai robert f smith mobile prostate cancer screening unit will be at black health matters spring health summit location riverside church 490 riverside dr new york ny 10027 time saturday april 30 at 9 00am to 5 00pm learn more,"screening,black,health,sinai","covid,foreign policy,health,social and cultural"
164,,,,happy earth day we are proud supporters of the bronx_river their mission is to reclaim the river restore habitats and ensure a future for far too long the bronx river was left polluted and forgotten over the past twenty years the local community and the alliance have joined together transforming the river and the bronx over 701 tons of garbage have been removed from the river and surrounding community and 96 acres of parkland have been restored,polluted,environment
165,,,,are you thinking to get an appeal do you have a chance at winning your case on appeal now we will discuss the most important factors you need to take into consideration when you are thinking about an appeal after you have read the article if you would like to hire my firm to handle your case please call the office at 917 885 2261 we will be happy to see if we can help nyimmigrationlawyer nyimmigration usimmigrationnews usimmigration usimmigrationlawyer caseappeal winyourcase casereopen casedenied nycimmigrationlawyeralenashautsova,no words,no topic
166,,,,here are two local jobs both are 7 pm start m f 12 hrs shift 1650 week 10 hrs shift 1500 week delivery of auto parts cages and some touch freight want more details drop us a line we have other pa jobs in carlisle york harrisburg and shippensburg too cdl labor logistics has better driving jobs for better cdl drivers we offer our cdl drivers benefits and have truck driving jobs with good pay and long term stability to learn more about this cdl driver job or our other cdl jobs apply now with the information we need to contact you as well as your preference for what cdl driving jobs you prefer we have home daily regional and otr driving jobs so you can put your cdl to work how you want to drive cdl labor logistics is an equal opportunity employer that is committed to diversity and inclusion in the workplace we prohibit discrimination and harassment of any kind based on race color sex religion sexual orientation national origin disability genetic information pregnancy or any other protected characteristic as outlined by federal state or local laws this policy applies to all cdl and non cdl employment practices within our organization including hiring recruiting promotion termination layoff recall leave of absence compensation benefits training and apprenticeship cdl labor logistics makes hiring decisions based solely on qualifications merit and business needs at the time we follow all applicable federal motor carrier safety administration fmcsa regulations and all applicable dot requirements in hiring and utilizing cdl drivers and for placements in cdl jobs,"discrimination,jobs,cages,pregnancy,sex,sexual orientation","economic,immigration,social and cultural"
167,,,,gurl she s in the new york times,no words,no topic
168,,,,does the bible still matter in the 21st century yes dennis prager author of the best selling bible commentary in america joins michael knowles to explain why,no words,no topic
169,,,,the bible after so many centuries remains the most important book in america why michael knowles and dennis prager discuss,no words,no topic
170,,,,daily news brief for friday april 22nd 2022 how s cnn doing push to end dept of education fl bill stripping disney of governing status staggering number of collapsing athletes help support us join the club fight cancel culture,education,education
171,,,,the left exploded after will smith smacked chris rock for telling a joke about jada smith s hair the left is trying to justify smith s actions by saying rock s joke is violence itself,no words,no topic
172,,,,the potential of elon musk buying twitter laid bare the media s overt contempt for free speech and love of censorship and suppression,no words,no topic
173,,,,product brand,no words,no topic
174,,,,shapiro breaks down why disney is backing off hot button political issues like florida s new parental rights in education bill,education,education
175,,,,florida s republican led senate passed a bill that eliminates a special taxing district that allows walt disney co to govern the land where its theme park is located shapiro reacts,taxing,economic
176,,,,acta s hero of intellectual freedom professor dorian abbot thanks those who attacked him and propelled his story of disinvitation and cancellation to the top of the news cycle over the past two years when your enemies make arguments like that who needs friends,enemies,foreign policy
177,,,,onestreamlive,no words,no topic
178,,,,icymi state police investigators association endorses cirencione for sheriff david cirencione is clearly the best candidate in the race for ontario county sheriff he has the extensive experience leadership qualities and uncompromising ethics that are required to lead the sheriff s office and keep the county s residents safe nyspia president timothy dymond and troop e delegate ken hilkert,police,safety
179,,,,erie county ny news erie county likely to reduce the tax you pay on gas,tax,economic
180,,,,with the release of his new book one damn thing after another attorney general bill barr speaks with the tca team about the dangers of progressivism the greatest threats to religious freedom and insightful stories about his faith and family life marking holy week we also revisit with father roger landry discussing our lenten journey in light of the easter vigil this weekend and also our need to keep the people of ukraine in prayer catch the show every saturday at 7amet 5pmet on ewtn radio,"religious freedom,barr","governance,social and cultural"
181,,,,breaking we are going toe to toe with hollywood abortion activists in our new project oh gosnell the truth about abortion will be a live performance in nyc released on the same day as jj abram s pro abortion one woman show,abortion,"health,social and cultural"
182,,,,get an intimate look at new york s shadow economy over 5 000 people walk through the streets of new york city collecting discarded cans and bottles cleaning up the community by making sure they re properly recycled in exchange for cash join us on a journey to nyc for our season premiere where we meet musician and canner pierre simmons and get to know the non profit recycling center dedicated to supporting the local immigrant community surewecannyc episode 1 is live listen learn and subscribe at the link in bio now marvelgd peopleoverplastic wastemafia podcast podcasts canner plastic pollution recycling climateemergency climatejustice newyork nyc bipoc stories storytelling news culture community society intersectionality socialactivism activism advocacy,economy,economic
183,,,,hello auburnians i m sarah klee hood and i m running for congress in your district ny 22 why am i running because i m from and live in central new york and i want to make it a better place to live for all i ve been labeled the nontraditional homegrown progressive in this race here s a bit more about me i m a mother i understand why we need high quality affordable childcare and early education i m a business leader i know what s needed to empower cny businesses and create jobs i m an environmental advocate i ve worked to promote clean tech startups i m a veteran i know what it means to serve my country and community and i promise to do that every day if elected to congress i will fight for our upstate communities our children and for our future learn more about why i m running and the issues i care about follow me on twitter or instagram sarahkleehoodny for my daily thoughts on how we can make central new york a better place for all,"jobs,childcare,early education,create jobs,education","economic,education,social programs"
184,,,,hello auburnians i m sarah klee hood and i m running for congress in your district ny 22 to understand the challenges we face as a district and community we need somebody with tested leadership experience i m a former u s air force officer and i m currently an elected town councilor here in this district i have the experience i know the problems and i m ready to fight for all of us i m here to fight for our communities for our children and for our future learn more about why i m running and the issues i care about at sarahkleehoodny com follow me on twitter or instagram sarahkleehoodny for my daily thoughts on how we can make central new york a better place for all,no words,no topic
185,,,,how does covid 19 affect children in the united states,"covid 19,covid",covid
186,,,,learn about lgbtq rights education standards and racial justice on today s new episode of activista rise up joining me for this important discussion is melanie willingham jaggers executive director of glsen glsen works to ensure that lgbtqia students are able to learn and grow in a school environment free from bullying and harassment for more information on glsen or to get involved visit glsen org lgbtq lgbtqia lgbtrights gayrights isaygay inclusion diversity socialjustice economicjustice education lgbtqyouth lgbtqcommunity activist activism arupodcast activistariseuppodcast podcasting podcast newepisode podcastersofcolor podcasters activistariseup,"school,racial,environment,education standards,education","education,environment,social and cultural,social programs"
187,,,,estos son los estados con la gasolina mas cara del paÃ­s,no words,no topic
188,,,,estos estados tienen la gasolina mas cara del paÃ­s descubre como ahorrar,no words,no topic
189,,,,climate change is an existential threat to humanity and we can t keep kicking the can down the road it is time for aggressive action by greenlighting renewable start ups giving them what they need to do their thing and transforming our energy system by 2026 photo credit jenn march the post star,"renewable,climate,climate change,energy system,aggressive action","environment,foreign policy"
190,,,,sign the national rifle association official petition today,no words,no topic
191,,,,take the national rifle association official survey today,no words,no topic
192,,,,why should biblical literacy matter today joining michael knowles in this episode of the book club is the author of the best selling bible commentary in america dennis prager,no words,no topic
193,,,,sabes cuÃ¡l es el salario mÃ­nimo del estado de nueva york sabes cuantas horas necesitas trabajar para recibir las horas extras quieres saber que puedes hacer si su empleador no te estÃ¡ pagando tienes preguntas sobre tus derechos como trabajador inmigrante jÃºntanos para un taller informativo sobre los derechos en el trabajo y las leyes del empleo en nueva york con los representantes de catholic migration services nyc consumer worker protection y new york committe for occupational safety and health aquellos que se registren y asistan al evento en vivo tendrÃ¡n la oportunidad de recibir una tarjeta de regalo,"health,migration,catholic","health,immigration,social and cultural"
194,,,,the humane society of new york a prominent shelter in midtown must either re open its doors to the public and resume adoptions in earnest or send the cats and dogs to other adoption centers because warehousing animals is inhumane please read and take action on behalf of the dozens of cats and dogs who have been languishing in cages for months and even years,cages,immigration
